{
  "schema_version": 1,
  "policy_kind": "sliding_window_ucb",
  "config": {"n_arms": 2, "initial_value": 0.25, "c": 2.0, "reward_scale": 1.5, "window_size": 3},
  "updates": [
    {"action": 0, "reward": 1.0},
    {"action": 1, "reward": 0.0},
    {"action": 0, "reward": 3.0},
    {"action": 1, "reward": 2.0}
  ],
  "checkpoints": [{
    "after_update": 4,
    "state": {"step": 4, "total_reward": 6.0, "counts": [1, 2], "estimates": [3.0, 1.0], "history_len": 3},
    "scores": {"bonuses": [2.2234557110512667, 1.5722206109523076]}
  }],
  "recommendation": 0,
  "reset_state": {"step": 0, "total_reward": 0.0, "counts": [0, 0], "estimates": [0.25, 0.25], "history_len": 0},
  "expected_error": null
}
