{
  "schema_version": 1,
  "policy_kind": "softmax",
  "config": {"n_arms": 2, "initial_value": 0.0, "temperature": 1.0},
  "updates": [
    {"action": 0, "reward": 2.0},
    {"action": 1, "reward": 1.0}
  ],
  "checkpoints": [
    {
      "after_update": 2,
      "state": {"step": 2, "total_reward": 3.0, "counts": [1, 1], "estimates": [2.0, 1.0]},
      "scores": {"probabilities": [0.7310585786300049, 0.2689414213699951]}
    }
  ],
  "recommendation": 0,
  "reset_state": {"step": 0, "total_reward": 0.0, "counts": [0, 0], "estimates": [0.0, 0.0]},
  "expected_error": null
}
