{
  "schema_version": 1,
  "policy_kind": "random",
  "config": {"n_arms": 3},
  "updates": [
    {"action": 0, "reward": 1.0},
    {"action": 2, "reward": 0.5},
    {"action": 0, "reward": 0.0}
  ],
  "checkpoints": [
    {
      "after_update": 3,
      "state": {"step": 3, "total_reward": 1.5, "counts": [2, 0, 1], "estimates": [0.5, 0.0, 0.5]},
      "scores": {}
    }
  ],
  "recommendation": 0,
  "reset_state": {"step": 0, "total_reward": 0.0, "counts": [0, 0, 0], "estimates": [0.0, 0.0, 0.0]},
  "expected_error": null
}
