{
  "schema_version": 1,
  "policy_kind": "median_elimination",
  "config": {"n_arms": 2, "epsilon": 1.0, "delta": 0.5},
  "updates": [{"action": 0, "reward": 1.0, "repeat": 160}, {"action": 1, "reward": 0.0, "repeat": 160}],
  "checkpoints": [{
    "after_update": 320,
    "state": {"step": 320, "total_reward": 160.0, "counts": [160, 160], "estimates": [1.0, 0.0], "active": [true, false], "phase_counts": [0, 0], "phase_sums": [0.0, 0.0], "phase_epsilon": 0.1875, "phase_delta": 0.125},
    "scores": {"phase_quota": 362}
  }],
  "recommendation": 0,
  "reset_state": {"step": 0, "total_reward": 0.0, "counts": [0, 0], "estimates": [0.0, 0.0], "active": [true, true], "phase_counts": [0, 0], "phase_sums": [0.0, 0.0], "phase_epsilon": 0.25, "phase_delta": 0.25},
  "expected_error": null
}
