{
  "schema_version": 1,
  "policy_kind": "kl_ucb",
  "config": {"n_arms": 2, "initial_value": 0.0, "c": 3.0, "tolerance": 1e-9, "max_iterations": 64},
  "updates": [
    {"action": 0, "reward": 1.0},
    {"action": 1, "reward": 0.0}
  ],
  "checkpoints": [
    {
      "after_update": 2,
      "state": {"step": 2, "total_reward": 1.0, "counts": [1, 1], "estimates": [1.0, 0.0]},
      "scores": {"indices": [1.0, 0.6229172656312585]}
    }
  ],
  "recommendation": 0,
  "reset_state": {"step": 0, "total_reward": 0.0, "counts": [0, 0], "estimates": [0.0, 0.0]},
  "expected_error": null
}
