{
  "schema_version": 1,
  "policy_kind": "epsilon_greedy",
  "config": {"n_arms": 2, "initial_value": 0.0, "epsilon": 0.2},
  "updates": [
    {"action": 0, "reward": 1.0},
    {"action": 1, "reward": 0.5}
  ],
  "checkpoints": [
    {
      "after_update": 2,
      "state": {"step": 2, "total_reward": 1.5, "counts": [1, 1], "estimates": [1.0, 0.5]},
      "scores": {"epsilon": 0.2}
    }
  ],
  "recommendation": 0,
  "reset_state": {"step": 0, "total_reward": 0.0, "counts": [0, 0], "estimates": [0.0, 0.0]},
  "expected_error": null
}
