{
  "schema_version": 1,
  "policy_kind": "moss",
  "config": {"n_arms": 2, "initial_value": 0.0, "horizon": 100, "c": 1.0, "reward_scale": 2.0},
  "updates": [
    {"action": 0, "reward": 1.0},
    {"action": 1, "reward": 0.0}
  ],
  "checkpoints": [
    {
      "after_update": 2,
      "state": {"step": 2, "total_reward": 1.0, "counts": [1, 1], "estimates": [1.0, 0.0]},
      "scores": {"bonuses": [3.955766932177954, 3.955766932177954]}
    }
  ],
  "recommendation": 0,
  "reset_state": {"step": 0, "total_reward": 0.0, "counts": [0, 0], "estimates": [0.0, 0.0]},
  "expected_error": null
}
