{
  "schema_version": 1,
  "policy_kind": "successive_elimination",
  "config": {"n_arms": 2, "delta": 0.5, "confidence_scale": 0.000001},
  "updates": [{"action": 0, "reward": 1.0}, {"action": 1, "reward": 0.0}],
  "checkpoints": [{
    "after_update": 2,
    "state": {"step": 2, "total_reward": 1.0, "counts": [1, 1], "estimates": [1.0, 0.0], "active": [true, false]},
    "scores": {"confidence_radii": [0.0000014420268866008829, 0.0000014420268866008829]}
  }],
  "recommendation": 0,
  "reset_state": {"step": 0, "total_reward": 0.0, "counts": [0, 0], "estimates": [0.0, 0.0], "active": [true, true]},
  "expected_error": null
}
